{"schema_version":"execution-state/1.0","limit_profile":"EXECUTION_JOURNAL_V1_FIXED_LIMITS","journal_binding":{"journal_id":"EJ-ONE","through_sequence":1,"through_event_id":"JE-ONE","through_event_sigil":"sha256:ab35540a99f75c38d45a733a6ef79bfd8a751cc82ef5210a407f6bb79ef2994d"},"executor":{"executor_instance_id":"XI-ONE","executor_epoch":1,"executor_build_binding":{"implementation_id":"LOCAL-EXECUTOR","implementation_version":"V1","source_revision_sigil":"sha256:aaaaaaaaaaaaaaaaaaaaaaaaaaaaaaaaaaaaaaaaaaaaaaaaaaaaaaaaaaaaaaaa","executable_artifact_sigil":"sha256:aaaaaaaaaaaaaaaaaaaaaaaaaaaaaaaaaaaaaaaaaaaaaaaaaaaaaaaaaaaaaaaa","dependency_set_sigil":"sha256:aaaaaaaaaaaaaaaaaaaaaaaaaaaaaaaaaaaaaaaaaaaaaaaaaaaaaaaaaaaaaaaa","build_configuration_sigil":"sha256:aaaaaaaaaaaaaaaaaaaaaaaaaaaaaaaaaaaaaaaaaaaaaaaaaaaaaaaaaaaaaaaa","executor_build_sigil":"sha256:2c0301cf657fe71300d0c2d295b0bb2cfcedb75803e355258ed543f907e55d20"},"revision":0,"clock_state":"TRUSTED","last_trusted_utc":"2026-08-06T00:00:00Z","clock_uncertain_event_id":null,"active_recovery_id":null,"authority_gates":[],"last_event_id":"JE-ONE","last_event_sigil":"sha256:ab35540a99f75c38d45a733a6ef79bfd8a751cc82ef5210a407f6bb79ef2994d"},"recoveries":[],"workers":[],"worker_sessions":[],"jobs":[],"attempts":[],"leases":[],"log_streams":[],"deadlines":[],"idempotency_records":[],"state_sigil":"sha256:1d9e957d006870deec9f24f458f454b70bb89c38eb1866722434ca423b6f1c2e"}
